event_name,date_and_time,description,location,cost,event_url,category,charity,organization_link
First Fridays @ the Manitoba Museum,March 7 @ 4:00 pm - 9:00 pm,"The Manitoba Museum is excited to partner with Manitoba Liquor & Lotteries to present our First Fridays programming! Join us on the First Friday of every month from 4 pm to 9 pm for free general admission to our three core attractions – the Museum Galleries, Planetarium, and Science Gallery. No ticket is required for First Friday programming unless otherwise specified.",Manitoba Museum,Not Available,https://manitobamuseum.ca/event/first-fridays/2025-03-07/,Culture and Heritage,Manitoba Museum,MANITOBAMUSEUM.CA
"Manidoo Miiniigooizowin, A Gift from the Creator",February 25 @ 10:00 am - 4:00 pm,"The exhibit celebrates the beauty and resilience of the Anishinaabe and Dakota peoples, and commemorates the 25th anniversary of the Southern Chiefs’ Organization (SCO). Featuring objects from the 34 Nations represented by SCO, Manidoo Miiniigooizowin, A Gift from the Creator is a celebration of the past, present, and future.  Many of the objects in this exhibit have been generously shared by individuals and families who proudly represent their respective Nations, and all were designed or made by talented artists and makers from the SCO member Nations. The exhibit also includes historical objects from the Manitoba Museum collections —community treasures from decades past. With both the ‘old’ and the ‘new’ on display, Manidoo Miiniigooizowin, A Gift from the Creator showcases a walk through many Dakota and Anishinaabe generations.  Manidoo Miiniigooizowin, A Gift from the Creator will be on display in the Discovery Room & Welcome Gallery at the Manitoba Museum until April 2025.",Manitoba Museum,Not Available,https://manitobamuseum.ca/event/manidoo-miiniigooizowin/2025-02-25/,Culture and Heritage,Manitoba Museum,MANITOBAMUSEUM.CA
Legends of the Northern Sky – Planetarium Show,February 25 @ 11:15 am - 12:00 pm,"Embark on a journey with the Indigenous peoples of the western plains of Canada and share in their wisdom conveyed by the stars. Alongside Ocek, the fisher, and his band of animal friends, audiences take a dangerous expedition south to retrieve summer and return it to the frozen north. To the Plains Cree, Ocek was forever running across the night sky, ensuring the arrival of summer after the cold, perilous winter.  Learn how the great bully, the giant bear Mista Maskwa, was finally tamed by a brave band of birds. This adventure is mapped in the stars as the birds chase Mista Maskwa every night, keeping us safe from his foul temperament.  The Indigenous people of North America connect with the night sky in fundamental ways that resonate with their world. In Legends of the Northern Sky, we learn and appreciate their stories in the stars and in turn, learn a little bit more about the spirit that connects us all.  Enjoy a visit to the Planetarium with an All Attraction Pass or your Manitoba Museum Membership! Planetarium seating is now on a first-come, first-served basis. Planetarium doors will open for seating 10 minutes prior to the scheduled start time; just show your Manitoba Museum Membership card or non-Member All Attraction Pass at the door.     Admission to the Manitoba Museum includes access to all three of our incredible attractions. Single attraction tickets and individual Planetarium show tickets are not available. ",Manitoba Museum,24,https://manitobamuseum.ca/event/legends-of-the-northern-sky-pl-winter2025/2025-02-25/,Culture and Heritage,Manitoba Museum,MANITOBAMUSEUM.CA
Aurorae – Planetarium Show,February 25 @ 3:00 pm - 3:45 pm,"The aurorae, or northern lights, are one of the most beautiful and mysterious sights in the night sky. Join us on an expedition to the Northwest Territories in northern Canada to see these shimmering curtains of light under pristine dark skies. We first see the northern lights as northern peoples have seen them for thousands of years, and appreciate their beautiful and varied forms.  Aurorae are not only beautiful, but they also hint at some of the fundamental properties of our planet Earth and its interaction with the Sun. Modern science has revealed some of the amazing processes that cause these beautiful lights in their many colours, but there is still more to learn. Aurorae explores the connection between solar activity and northern lights, highlighting the latest science and looking ahead to the upcoming solar maximum next year.  Enjoy a visit to the Planetarium with an All Attraction Pass or your Manitoba Museum Membership! Planetarium seating is now on a first-come, first-served basis. Planetarium doors will open for seating 10 minutes prior to the scheduled start time; just show your Manitoba Museum Membership card or non-Member All Attraction Pass at the door.     Admission to the Manitoba Museum includes access to all three of our incredible attractions. Single attraction tickets and individual Planetarium show tickets are not available. ",Manitoba  Museum,24,https://manitobamuseum.ca/event/aurorae-pl-winter2025/2025-02-25/,Culture and Heritage,Manitoba Museum,MANITOBAMUSEUM.CA
DOME@HOME,February 27 @ 7:00 pm - 8:00 pm,"Hosted by Planetarium astronomer Scott Young, Dome@Home brings the wonders of the universe to anyone with an internet connection. The show’s content focuses on all of the celestial sights and special events that viewers can see over the next month.     Next show: Thursday, February 27, 2025 @ 7:00 pm (Central Time)  Join us on Dome@Home this month, as we dive into the details of the March 13-14 total lunar eclipse. Manitobans will have front-row seats as the Moon turns red. We’ll cover where and when to watch the eclipse, helpful observing accessories from binoculars to telescopes to hot tubs, and tips for how to capture your own images of the event.  Plus, we’ll be sharing share viewer images of the sky and chat about all the cool space stuff that’s happened over the past month.",Manitoba Museum,Free,https://manitobamuseum.ca/event/domehome/2025-02-27/,Culture and Heritage,Manitoba Museum,MANITOBAMUSEUM.CA
The Great Solar System Adventure – Planetarium Show,March 1 @ 11:00 am - 11:45 am,"Join showman extraordinaire “The Great Schiaparelli” as he takes the audience on a death-defying space-time adventure within his wondrous Observatorium.  From the sun-scorched surface of Mercury to the icy expanses of Pluto and beyond, prepare to be subjected to the myriad dangers and wonders of our Solar System, on a breathtaking tour that reveals just how precious our home planet really is. Be warned though, the Observatorium isn’t just for show. It will transport the audience right to the heart of some of the deadliest locations in our slice of the heavens. It’s going to take some fancy flying to get everyone back in one piece!  Enjoy a visit to the Planetarium with an All Attraction Pass or your Manitoba Museum Membership! Planetarium seating is now on a first-come, first-served basis. Planetarium doors will open for seating 10 minutes prior to the scheduled start time; just show your Manitoba Museum Membership card or non-Member All Attraction Pass at the door.     Admission to the Manitoba Museum includes access to all three of our incredible attractions. Single attraction tickets and individual Planetarium show tickets are not available.",Manitoba Museum,24,https://manitobamuseum.ca/event/great-solar-system-adventure-pl-winter2025/2025-03-01/,Culture and Heritage,Manitoba Museum,MANITOBAMUSEUM.CA
Manitoba Skies – Planetarium Show,March 1 @ 1:45 pm - 2:30 pm,"Take a guided tour of Manitoba’s night sky. This live show, presented by our planetarium staff, highlights the constellations, planets, and celestial events that you can see on clear evenings, and answer your space questions.  Enjoy a visit to the Planetarium with an All Attraction Pass or your Manitoba Museum Membership! Planetarium seating is now on a first-come, first-served basis. Planetarium doors will open for seating 10 minutes prior to the scheduled start time; just show your Manitoba Museum Membership card or non-Member All Attraction Pass at the door.     Admission to the Manitoba Museum includes access to all three of our incredible attractions. Single attraction tickets and individual Planetarium show tickets are not available. ",Manito Museum,24,https://manitobamuseum.ca/event/manitoba-skies-pl-winter2025/2025-03-01/,Culture and Heritage,Manitoba Museum,MANITOBAMUSEUM.CA
KNIGHTS & TIARAS: ENCHANTED KINGDON ADVENTURE,"May 3, 2025","Step into a magical world of knights, tiaras and enchanting adventures! This family friendly gala is sure to spark your imagination and bring fairytales to life. Stay tuned for details!",Not Available,Not Available,https://mcrc.on.ca/events/,Community Services and Resource Center,Milton Community Resource Centre,www.mcrc.on.ca
Muskoka 70.3 & Florida Ironman,6 Jul 25  9:00 am,"About the event Ryan, Kyle and Brayden, The founders of Beyond The Run will be attempting Ironman 70.3 Muskoka in Huntsville, Ontario, Canada to raise money and spread awareness for men's mental health support. Their initiative ""Beyond The Run"" is an active effort to provide coping methods for men","Huntsville, ON",Not Available,https://ca.movember.com/en/events/view/id/Qeq0,Health Care,Movember Canada,CA.MOVEMBER.COM
www.mscanada.ca,"March 20, 2025","MS Hear From The Experts is a series of webinars that help people better understand multiple sclerosis, highlights MS-related resources, plus provides tools and tips to navigate their MS Journey with more knowledge and confidence. Our intention is to help individuals learn more about the disease, treatments, research, wellness strategies, about the MS Canada programs, and much more.  Phone-only participation will be available. The broadcasts are presented in English with no cost for participation. For information and to register for upcoming webinars presented in French, please visit our « Ce qu’en disent les experts » webpage.",Online,Free,https://mscanada.ca/take-action/community-events/ms-hear-from-the-experts-webinars-acceptance-resilience,Diseases and Conditions,Multiple Sclerosis Canada,www.mscanada.ca
"Take action and create impact at MS Walk on Sunday May 25, 2025","Sunday May 25, 2025",Join us this May as our community made up of tens of thousands of Canadians walks together to show that no person living with multiple sclerosis is alone. Fundraise to make lives better for people living with MS. Register for MS Walk today as we walk toward living in a world free of MS," ​Laggasse Park, 4501 Lakeshore Drive, St. Paul",Not Available,https://msspwalk.donordrive.com/?language=en&utm_source=eventlisting&utm_medium=website&utm_campaign=WALK,Diseases and Conditions,Multiple Sclerosis Canada,www.mscanada.ca
Family and Caregiver Retreats,"May 23-24-25, 2025","Family and Caregiver Retreats help clients, their family members and caregivers connect with others who are living similar experiences to provide support and help reduce social stigmas. These Family and Caregiver Retreats offer a weekend ‘away from it all’ in a safe, welcoming, and natural setting. Family and Caregiver Retreats provide:  An opportunity for attendees to meet and socialize with others who have similar experiences; An opportunity to gain useful insights from experts and other families about caring for themselves and their loved ones; Access to a range of complementary therapy services and information sessions; An assortment of leisure and social activities; A well-deserved break from some of the demands of daily life; Social gatherings to foster friendship and a sense of community; The Family Retreats also offer opportunities for children living with a neuromuscular disorder to meet other children with similar experiences and develop new friendships.",Rawdon Golf Resort.,Not Available,https://muscle.ca/services-support/personal-support-program/family-and-caregiver-retreats/,Diseases and Conditions,"Muscular Dystrophy Canada, National Office",www.muscle.ca
Easter Egg Hunt For Dogs & Their Families Fundraiser,"Apr 18, 2025 Time: 10:00 am to 12:30 pm","REGISTER as an EARLY BIRD and SAVE ! $20 per Family. Opens on Friday Feb 7, 2025 and will run until March 7, 2025 11:59pm EST. Scroll to the bottom of the page to register for an event near you! EARLY BIRD FUNDRAISING: Raise $500 to snag a cool NSD Branded Treat Pouch, or aim higher with $750 to score an awesome NSD Branded Sweatshirt. Items will be available for pick up at your hunt location. Any Participant/Team that raises $5000 or more will have the opportunity to sponsor and name a puppy!  Contact Cindy Webb Events Coordinator for any questions you may have cindy@nsd.on.ca There are many ways to get involved in the Easter Egg Hunt and positively impact a life!  Consider becoming a Local Hunt Sponsor! Check out our Sponsorship Package Here","Kitchener, Guelph, Hamilton, London, Windsor, Ottawa(Tentative)and Calgary.",20,https://nsd.on.ca/get-involved/events/easter-egg-hunt/,Disabilities and Accessibility Services,National Service Dog Training Centre,WWW.NSD.ON.CA 
27th Annual Easter Egg Hunt for Dogs!,"Apr 18, 2025 Time: 10:00 am to 12:30 pm",,"Six Hunts will be held simultaneously in the Ontario cities of ﻿Kitchener-Waterloo, Guelph, London, Windsor, Hamilton and Calgary, Alberta.",25,https://nsd.on.ca/event/27th-annual-easter-egg-hunt-for-dogs/,Disabilities and Accessibility Services,National Service Dog Training Centre,WWW.NSD.ON.CA 
Spring Fling Inspire,april 5 2025,"This year's Spring Fling Gala is set to INSPIRE. This vibrant evening features engaging displays that illustrate how purchases and initiatives made possible through our generous donors, improved local healthcare programs and services.  The Gala will feature great food, cash bar, exciting fundraising activities, and a live auction. It's a fantastic networking opportunity for community leaders, healthcare professionals, and supporters to connect and collaborate.  Get dressed up, grab your friends and we'll see you at Spring Fling!",Shell Place Grand Ballroom at MacDonald Island Park.,214,https://www.eventbrite.ca/e/northern-lights-health-foundations-spring-fling-inspire-gala-tickets-1246220151019?aff=oddtdtcreator,Health Care,Northern Lights Health Foundation,WWW.NORTHERNLIGHTSHEALTHFOUNDATION.CA
61st Annual General Meeting,march 18 2025 5.30,,Norwood Child And Family Resource Center Edmonton AB 95156-114 Ave,Not Available,https://www.norwoodcentre.com/post/61st-annual-general-meeting,Community Services and Resource Center,Norwood Child and Family Resource Centre,www.norwoodcentre.com
eal Tea: for everyone diagnosed with ovarian cancer,"February 25, 2025 1:00 p.m. ET - 2:00 p.m. ET 2:00 p.m. AT - 3:00 p.m. AT 10:00 a.m. PT - 11:00 a.m. PT","Teal Tea is a time for connection and conversation, where women with ovarian cancer can share their stories and learn from one another. It’s a small group gathering that takes place entirely online. If you have not yet attended, we would love to meet you.  Everyone diagnosed with ovarian cancer is welcome to join this session to meet fellow Teal Sisters living with the disease.  Teal Tea is not a professionally facilitated support group. To ensure a safe and inclusive environment, please review the group guidelines ahead of time.  You are welcome to join us for Teal Tea as often as you wish. A variety of dates and times are available monthly and the events page is updated as new sessions are scheduled.  Questions about Teal Tea gatherings? Please email us at tealtea@ovariancanada.org.",Online,Not Available,https://ovariancanada.org/events/teal-tea-for-everyone-diagnosed-with-ovarian-cancer,Diseases and Conditions,Ovarian Cancer Canada,WWW.OVARIANCANADA.ORG
Support Group: Ovarian Cancer | Six-week program,26 February 2025 - 2 April 2025 5:00 p.m. ET - 6:30 p.m ET,"Presented in partnership with Wellspring Cancer Support, the Support Group: Ovarian Cancer is a professionally led program that meets weekly for six weeks. Participants will explore relevant themes, including coping with change and will have an opportunity to share within and build a community of support.  You must register for this program and commit to the six weeks. Spots are limited per group, however, as additional groups and spots become available, you will be notified.  By clicking ‘Register’ you will be taken to Wellspring Cancer Support’s website to register for this support group.",Online,Not Available,https://ovariancanada.org/events/ovarian-cancer-support-group-copy-2,Diseases and Conditions,Ovarian Cancer Canada,WWW.OVARIANCANADA.ORG
Teal Tea: for young people with ovarian cancer,"February 26, 2025 7:00 p.m. ET - 8:00 p.m. ET 8:00 p.m. AT - 9:00 p.m. AT 4:00 p.m. PT - 5:00 p.m. PT","This session focuses on young people living with ovarian cancer. Please join us if you are under 50 years old, or young at heart, and have received a diagnosis.  Teal Tea is not a professionally facilitated support group. To ensure a safe and inclusive environment, please review the group guidelines ahead of time.  You are welcome to join us for Teal Tea as often as you wish. A variety of dates and times are available monthly and the events page is updated as new sessions are scheduled.  Questions about Teal Tea gatherings? Please email us at tealtea@ovariancanada.org.",Online,Not Available,https://ovariancanada.org/events/teal-tea-for-young-people-with-ovarian-cancer-1-2,Diseases and Conditions,Ovarian Cancer Canada,WWW.OVARIANCANADA.ORG
Celebrate Womanhood,"March 8, 2025 The Highlander Spa (1597 South Park St - Halifax) | 9:00 a.m. - 9:00 p.m. AT","This International Women’s Day, March 8, 2025, the Highlander Spa is excited to support Ovarian Cancer Canada and to pamper and celebrate the women and members of our community. Profits from this event directly contribute to advancing ovarian cancer research, supporting those affected by the disease, and spreading awareness.  Grab a friend and join us for a rejuvenating spa experience in support of Ovarian Cancer Canada, where relaxation meets empowerment. Immerse yourself in a serene ambiance with soothing spa services, refreshing drinks, and yummy snacks. Unwind in good company, and embrace the calming atmosphere while dressed in red to honor International Women’s Day. Feel the warmth of community spirit, and don’t miss the chance to win a fabulous prize in our special draw. Furthermore, from 4pm-9pm, enjoy the entertainment of DJ Henry T and Vassa who will keep the good times going. Together, we’ll demand change, deliver action, and transform lives!  Your $75 ticket (within your chosen time slot) includes:  1 complimentary express service (add-ons for each service will be available for purchase on site) 1 complimentary mocktail Complimentary munchies EXPRESS SERVICE OPTIONS (30 minutes) Manicure Pedicure Facial Massage Men’s Cut Women’s Dry Cut or Styling *Please call or email the Highlander Spa to confirm your service within your chosen time slot at 902-429-3022 or info.thehighlanderspa@gmail.com.",The Highlander Med Spa & Salon,81,https://www.eventbrite.com/e/celebrate-womanhood-in-partnership-with-ovarian-cancer-canada-tickets-1255874687999?utm-campaign=social&utm-content=attendeeshare&utm-medium=discovery&utm-term=listing&utm-source=cp&aff=ebdsshcopyurl,Diseases and Conditions,Ovarian Cancer Canada,WWW.OVARIANCANADA.ORG
Teal Tea: for everyone diagnosed with ovarian cancer,"March 25, 2025 1:00 p.m. ET - 2:00 p.m. ET 2:00 p.m. AT - 3:00 p.m. AT 10:00 a.m. PT - 11:00 a.m. PT","Teal Tea is a time for connection and conversation, where women with ovarian cancer can share their stories and learn from one another. It’s a small group gathering that takes place entirely online. If you have not yet attended, we would love to meet you.  Everyone diagnosed with ovarian cancer is welcome to join this session to meet fellow Teal Sisters living with the disease.  Teal Tea is not a professionally facilitated support group. To ensure a safe and inclusive environment, please review the group guidelines ahead of time.  You are welcome to join us for Teal Tea as often as you wish. A variety of dates and times are available monthly and the events page is updated as new sessions are scheduled.  Questions about Teal Tea gatherings? Please email us at tealtea@ovariancanada.org.",Online,Not Available,https://ovariancanada.org/events/teal-tea-for-everyone-diagnosed-with-ovarian-cancer-1-2,Diseases and Conditions,Ovarian Cancer Canada,WWW.OVARIANCANADA.ORG
Women’s whole health retreat,"March 28 - 29, 2025 Regina, SK | Fri. March 28, 6 p.m. - 9 p.m. Sat. March 29, 9 a.m. - 4 p.m.","Join the Saskatchewan Ovarian Cancer Survivors and Inpower Breast Cancer Survivors for a “Women’s whole health retreat” on March 28-29, 2025 in Regina. This in-person event includes sessions for survivors and their loved ones engage in sessions focused on research, resources and support. There will also be time for networking with others affected by ovarian or breast cancer.  The event will kick off at 6 pm at The Atlas Hotel for an evening of connection including a networking dinner. Then on Saturday, at the Southern Horizons Area Guide Centre’s Girl Guide Hall, you’ll hear insightful information from industry experts and people with lived experience.  Expert speakers joining the event include:  Anne Katz, Certified Sexuality Counsellor and Clinical Nurse Specialist Amanda Cameron, Nurse Practitioner and Menopause Society Practitioner Suzanne Funk, Physical Therapist Angelique Lang, Certified Genetics Counsellor Lindsey Roysom, Occupational Therapist And more! Topic highlights include:  Sexual changes after a cancer diagnosis Surgically induced menopause Genetics at play Cognitive hygiene strategies, causes of brain fog and return to work strategies Interactive arts therapy activity And more! All of this for only $25 registration fee! This fee assists in covering costs related to venue and equipment rentals, meals, and speaker engagement. Register by: March 12, 2025.  This event is hosted by Saskatchewan Ovarian Cancer Survivors and Inpower Breast Cancer Survivors in partnership with Ovarian Cancer Canada.","Regina, SK",25,https://ovariancanada.org/events/womens-whole-health-retreat,Diseases and Conditions,Ovarian Cancer Canada,WWW.OVARIANCANADA.ORG
BMO Vancouver Marathon,"May 4, 2025   7 am","Ovarian Cancer Canada is proud to be an official charity of the BMO Vancouver Marathon RUN4HOPE.   Variety of route distances to choose from. Sign up and fundraise for Ovarian Cancer Canada as your charity of choice.  Your race includes:  Exclusive new tech tee Finishers medal for in-person races Two-day health, sports, and lifestyle expo Brooks running bonus prize if you combine races Results, leaderboard, and more If you have any questions please contact our fundraising team.","Queen Elizabeth Park, Vancouver, BC ",Not Available,https://ovariancanada.org/events/bmo-vancouver-marathon,Diseases and Conditions,Ovarian Cancer Canada,WWW.OVARIANCANADA.ORG
Teal 2 Heal,"May 3, 2025 Espace Jax: 1439 rue Sainte-Catherine Ouest, Montreal QC H3G 1S6 | 6:00 p.m. - 11:00 p.m. ET","(Doors open at 6pm and show starts at 8pm)  Teal 2 Heal is an event to raise money and awareness for ovarian cancer through various forms of art.  The night will start with a cocktail dînatoire with different finger foods available all night as well as a cash bar.  Also featured throughout the evening will be the following:  A fashion show featuring a few ovarian cancer survivors. Live musical performances featuring some of the Pop, Disco, Soul & Reggae classics hits that we know and love. A mini art exhibition by an ovarian cancer survivor. A live painting made throughout the evening to be given away to a lucky guest. A silent online auction. Impactful speeches. This is an evening full of excitement that you won’t want to miss!  For more information and sponsorship inquiries, please reach out to bkpro66@hotmail.com.","Espace Jax: 1439 rue Sainte-Catherine Ouest, Montreal QC H3G 1S6",80,https://ovariancanada.org/events/teal-2-heal,Diseases and Conditions,Ovarian Cancer Canada,WWW.OVARIANCANADA.ORG
THE LADY BALL Halifax,"May 8, 2025 Steele Wheels Motor Museum, Halifax | 6:00 p.m. AT - 9:30 p.m. AT","THE LADY BALL is making its grand return to Halifax for 2025 – and it’s going to be an evening to remember!  On May 8, get ready to immerse yourself in a night of pure glamour at the stunning Steele Wheels Auto Museum.  This eagerly awaited annual fundraising gala, in support of Ovarian Cancer Canada, is the premier event of the year in Halifax. Last year’s event sold out and raised over $156,000, all for a cause that means so much to so many.  Every dollar raised at THE LADY BALL directly contributes to advancing ovarian cancer research, supporting those affected by the disease, and spreading awareness. You won’t want to miss this chance to make a meaningful impact while enjoying a truly unforgettable night.  Save the date, secure your seat and prepare for an evening of glamour, generosity, and community!","Steele Wheels Motor Museum, Halifax ",250,https://ovariancanada.org/events/the-lady-ball-halifax,Diseases and Conditions,Ovarian Cancer Canada,WWW.OVARIANCANADA.ORG
