event_name,date_and_time,description,location,cost,event_url,category,charity,organization_link
Emera Blue Nose Marathon,"May 16 - 18, 2025","Variety of route distances to choose from.  The Emera Blue Nose Marathon welcomes participants of all ages and abilities to promote and celebrate healthy living and active lifestyles. Sign up and fundraise for Ovarian Cancer Canada!  The event includes:  Blue Nose Marathon Expo Presented by Subaru Premium ASICS Runkeeper Go™ trial Routes with stunning views of Halifax and Dartmouth Participant shirt Personalized race bib (if registered by 5:00 PM on Wednesday, April 23, 2025) Blue Nose Marathon medal Chip-timed race If you have any questions please contact our fundraising team.","Emera Oval, Cogswell Street, Halifax, NS",Not Available,https://ovariancanada.org/events/emera-blue-nose-marathon,Diseases and Conditions,Ovarian Cancer Canada,WWW.OVARIANCANADA.ORG
Yoga for Grief & Loss - March 2025 (Evening Practice),"Friday, March 14","Join us for an gentle candlelit yoga session designed to support individuals navigating grief and loss. This in-person event will take place at Hospice Fredericton's Centre for HOPE (621 Churchill Row, Fredericton, NB, Canada) with admission by donation to Hospice Fredericton.  Our experienced instructor Erin Gibbs will guide you through gentle yoga poses and breathing exercises, promoting healing and emotional well-being. Whether you're seeking solace or looking to connect with others who understand, this event offers a safe and nurturing space. No prior yoga experience is required. Come as you are, and let yoga help you find peace amidst the challenges of grief and loss.","621 Churchill Row, Fredericton, NB, Canada",Not Available,https://www.eventbrite.ca/e/yoga-for-grief-loss-march-2025-evening-practice-registration-1118064534119,"Long-term, Palliative care and Hospice",Palliative Care Resource Network Inc.,WWW.HOSPICEFREDERICTON.CA
Grief Café - March 2025,"Monday, March 17 2025","A safe space to connect, share, and deepen your understanding of grief and loss","621 Churchill Row, Fredericton, NB, Canada",Free,https://www.eventbrite.ca/e/grief-cafe-march-2025-registration-1256660799279,"Long-term, Palliative care and Hospice",Palliative Care Resource Network Inc.,WWW.HOSPICEFREDERICTON.CA
Yoga for Grief & Loss - March 2025 (Morning Practice),"Sat, Mar 29, 2025 9:00 AM - 10:15 AM ADT","Join Hospice Fredericton on your mat for a Saturday morning practice where we will land in restorative poses to support the body, open the heart, and ease the mind as we build relationship with grief and loss.  Our experienced instructor Erin Gibbs will begin each practice with a grounding breath pattern followed by slow and gentle movement before landing in restorative shapes supported by props allowing you to release. Guided meditations may also be included. This in-person event will take place at Hospice Fredericton's Centre for HOPE (621 Churchill Row, Fredericton, NB, Canada) with admission by donation to Hospice Fredericton.  Whether you're seeking solace or looking to connect with others who understand, this event offers a safe and nurturing space. No prior yoga experience is required. Come as you are, and let yoga help you find peace amidst the challenges of grief and loss.","621 Churchill Row, Fredericton, NB, Canada",Not Available,https://www.eventbrite.ca/e/yoga-for-grief-loss-march-2025-morning-practice-registration-1137686333449,"Long-term, Palliative care and Hospice",Palliative Care Resource Network Inc.,WWW.HOSPICEFREDERICTON.CA
Seminar: Estate Planning For Seniors,"Thursday, March 6, 2025","Wondering how to find peace of mind when planning your estate? Join us as we discuss 10 things to know in estate planning, including but not limited to how to reduce taxes, minimize probate, and increase gifts to charity.  Don’t wait, RSVP today for this FREE seminar, Estate Planning for Seniors. Hear from industry experts Dave Lee, Senior Wealth Advisor at ScotiaMcLeod® and Monique Trépanier, Estate and Trust Consultant at ScotiaTrust®, to learn the things you need to know when estate planning and ensure you gain peace of mind regarding your estate plans.   Join us to learn how to:  Minimize taxes and probate in your estate plan  Leave a lasting legacy for your family and for the charities close to your heart Ensure your wishes are carried out  There is great power in charitable giving, you become part of something bigger, and you connect at a deeper level with your community. Hear from Ilona Scott, Philanthropy Officer, Legacy Giving at Peace Arch Hospital Foundation to learn how gifts like these are making a big impact on your community, today and for generations to come.  Continue reading below to learn more about the presenters, Dave Lee and Monique Trépanier!","100 - 1676 Martin Drive, White Rock",Free,https://www.pahfoundation.ca/events/seminar-estate-planning-for-seniors/,Community Services and Resource Center,Peace Arch Hospital and Community,PAHFOUNDATION.CA 
The Peace Arch Hospital Gala,"May 3, 2025 4.30 pm","You have never experienced New Orleans, Louisiana like this... The award-winning Peace Arch Hospital Gala is back, featuring the mysterious world of The Big Easy after dark. Enter Bourbon Street, where the sound of brass bands and street performers create a vibrant tapestry woven with the threads of history, music, and life itself.   Join us as we immerse you in fascinating Cajun culture and cuisine, along with the allure of the French Quarter where anything, and everything, happens under the shadowy cover of night. Beneath the flickering lights and the starry New Orleans sky, there is a celebration of the senses — it’s wild, chaotic, and utterly unforgettable. This is a place where stories collide; each corner whispers of the rich history of fortunes untold and the jazz legends who once roamed these streets. Lose yourself in its embrace and feel the energy linger long after the music fades.  Every dollar raised will support Peace Arch Hospital so your family, and every family, can receive the best care possible.  Tickets are on sale now!","Centennial Arena 14600 North Bluff Road, White Rock, BC",500,https://www.pahfoundation.ca/events/peace-arch-hospital-gala/,Community Services and Resource Center,Peace Arch Hospital and Community,PAHFOUNDATION.CA 
HSO Webinar,"February 18, 2025 at 9:00 am","Online Webinar  Praxis Spinal Cord Institute (Praxis), the Health Standards Organization (HSO) and Accreditation Canada (AC) invite you to join us on February 18th  to learn about the new Canadian National Standard for spinal cord injury (SCI) for health care programs providing care to people with SCI. CAN/HSO S3402:2024 (E) Integrated People-Centred Spinal Cord Injury Rehabilitation Program is a new standard that consolidates two previous HSO standards: HSO 3401:2018 (E) Spinal Cord Injury Acute Services, and HSO S3402:2018 (E) Spinal Cord Injury Rehabilitation Services.  This 90 min webinar will allow key stakeholders, including people with lived experience of SCI (PLEX), hospital leadership, and clinicians, to learn about the new standard and principles behind its development. There will also be an interactive question and answer opportunity.  We hope you’ll join us as we start the conversation about the future of SCI accreditation in Canada.  Learning Objectives:  Increase awareness of the new SCI Standard Provide an opportunity for key stakeholders to learn more about the Standard development and future of SCI accreditation in Canada Share key initiatives, best practices, and other SCI resources which contributed to the Standard, as well as showcase real-world examples on integrating criteria within the Standard Opportunity for stakeholders to ask questions directly to Accreditation Canada/HSO/Praxis",Online,Free,https://praxisinstitute.org/events/improving-spinal-cord-injury-standards-in-canada-taking-a-people-centered-approach-to-achieve-an-integrated-rehabilitation-program-webinar/,Diseases and Conditions,Praxis Spinal Cord Institute,WWW.RICKHANSENINSTITUTE.ORG
Seniors Martial Arts,Feb 24th 4:00 p.m.-5:00 p.m.,,"127 Eddystone Ave, Toronto, ON M3N 1H5, Canada",Not available,https://peachtoronto.com/calendar,Community Services and Resource Center,Promoting Education and Community Health (PEACH),https://peachtoronto.com/
PEACH Foodbank Community Food Distribution,Feb 25th   9:00 a.m.-10:30 a.m.,"Visit PEACH Foodbank for food distribution everyTuesday from 9:00 AM to 10:30 AM. Bring your full name, contact number, and your own bags. For info or pre-registration, emailexecutive.director@peachtoronto.com or call (416) 740-9593. Together, we nourish our community.","127 Eddystone Ave, Toronto, ON M3N 1H5, Canada",Not Available,https://peachtoronto.com/calendar,Community Services and Resource Center,Promoting Education and Community Health (PEACH),https://peachtoronto.com/
PEACH Kids' Reading Circle,Feb 25th,,Not Available,Not available,https://peachtoronto.com/calendar,Community Services and Resource Center,Promoting Education and Community Health (PEACH),https://peachtoronto.com/
Seniors exercise,Feb 26th,"Join us for a delightful gathering at the Senior Social Club! Connect with fellow seniors, enjoy engaging activities, and build lasting friendships. Whether you’re interested in games, discussions, or simply sharing stories, this club is for you.Activities may include:Trivia gamesCraft sessionsHealth and wellness talksCome and be part of our vibrant community! ","Peach Promoting Education & Community Health, 127 Eddystone Ave, North York, ON M3N 1H6, Canada",Not Available,https://peachtoronto.com/calendar,Community Services and Resource Center,Promoting Education and Community Health (PEACH),https://peachtoronto.com/
Seniors social club,Feb 26th   11:00 a.m.-12:00 p.m,,Not avalable,Not available,https://peachtoronto.com/calendar,Community Services and Resource Center,Promoting Education and Community Health (PEACH),https://peachtoronto.com/
Youth Martial Arts Class,Feb 27th  4:00 p.m.-6:00 p.m.,"Benefits include making friends and health connections, enhancing physical fitness, building muscle and bone strength, combatting aging effects, and improving safety.Suitable for all skill levels.","127 Eddystone Ave, Toronto, ON M3N 1H5, Canada",Not available,https://peachtoronto.com/calendar,Community Services and Resource Center,Promoting Education and Community Health (PEACH),https://peachtoronto.com/
PEACH CLOSED,Feb 28th  12:00 p.m.-1:00 p.m.,,"127 Eddystone Ave, Toronto, ON M3N 1H5, Canada",Not Available,https://peachtoronto.com/calendar,Community Services and Resource Center,Promoting Education and Community Health (PEACH),https://peachtoronto.com/
Seniors Martial Arts,Mar 3rd 4:00 p.m.-5:00 p.m.     2025,,"127 Eddystone Ave, Toronto, ON M3N 1H5, Canada",Not available,https://peachtoronto.com/calendar,Community Services and Resource Center,Promoting Education and Community Health (PEACH),https://peachtoronto.com/
PEACH Foodbank Community Food Distribution,Mar 4th  9:00 a.m.-10:30 a.m  2025,"Visit PEACH Foodbank for food distribution everyTuesday from 9:00 AM to 10:30 AM. Bring your full name, contact number, and your own bags. For info or pre-registration, emailexecutive.director@peachtoronto.com or call (416) 740-9593. Together, we nourish our community.","127 Eddystone Ave, Toronto, ON M3N 1H5, Canada",Not Available,https://peachtoronto.com/calendar,Community Services and Resource Center,Promoting Education and Community Health (PEACH),https://peachtoronto.com/
PEACH Kids' Reading Circle,Mar 4th  3:00 p.m.-5:30 p.m.,,Not Available,Not Available,https://peachtoronto.com/calendar,Community Services and Resource Center,Promoting Education and Community Health (PEACH),https://peachtoronto.com/
Seniors exercise,Mar 5th   10:00 a.m.-11:00 a.m.,"Join us for a delightful gathering at the Senior Social Club! Connect with fellow seniors, enjoy engaging activities, and build lasting friendships. Whether you’re interested in games, discussions, or simply sharing stories, this club is for you.Activities may include:Trivia gamesCraft sessionsHealth and wellness talksCome and be part of our vibrant community! ","Peach Promoting Education & Community Health, 127 Eddystone Ave, North York, ON M3N 1H6, Canada",Not Available,https://peachtoronto.com/calendar,Community Services and Resource Center,Promoting Education and Community Health (PEACH),https://peachtoronto.com/
Wadoka Academy - Adults Class,May 29th  6:00 p.m.-7:00 p.m.,,"127 Eddystone Ave, Toronto, ON M3N 1H5, Canada",Not available,https://peachtoronto.com/calendar,Community Services and Resource Center,Promoting Education and Community Health (PEACH),https://peachtoronto.com/
Youth Martial Arts Class,May 29th  4:00 p.m.-6:00 p.m.,"Benefits include making friends and health connections, enhancing physical fitness, building muscle and bone strength, combatting aging effects, and improving safety.Suitable for all skill levels.","127 Eddystone Ave, Toronto, ON M3N 1H5, Canada",Not available,https://peachtoronto.com/calendar,Community Services and Resource Center,Promoting Education and Community Health (PEACH),https://peachtoronto.com/
